<porudzbina xmlns:xsi="http://www.w3.org/2001/XMLSchema-instance"
    xsi:noNamespaceSchemaLocation="porudzbina-structure.xsd">
    <broj>123ABBCC123</broj>
    <elementi>
        <kosulja broj="525">
            <kolicina>4</kolicina>
            <boja opis="plava" />
        </kosulja>
        <kosulja broj="520">
            <kolicina>1</kolicina>
            <boja opis="siva" />
        </kosulja>
        <kapa broj="533">
            <kolicina>1</kolicina>
        </kapa>
    </elementi>
    <proizvodi>
        <proizvod>
            <broj>525</broj>
            <naziv>Short-Sleeved Linen Blouse</naziv>
            <cena valuta="USD">29.99</cena>
        </proizvod>
        <proizvod>
            <broj>533</broj>
            <naziv>Ten-Gallon Hat</naziv>
            <cena valuta="USD">69.99</cena>
        </proizvod>
        <proizvod>
            <broj>520</broj>
            <naziv>plava kosialja</naziv>
            <cena valuta="USD">69.99</cena>
        </proizvod>
    </proizvodi>
</porudzbina>